Reviewer,Group Name,Member Name,Dev Value,Report Value,Dev Comments,Report Comments
Nora Noodle,Group A,Nora Noodle,25,20,"Implemented core features and kept branches moving.","Wrote sections and helped polish the final draft."
Nora Noodle,Group A,Percy Pumpkin,20,20,"Contributed steady implementation work and code review.","Produced a fair share of report writing."
Nora Noodle,Group A,Silas Snicket,20,20,"Handled assigned tasks with acceptable quality.","Completed expected report work."
Nora Noodle,Group A,Winnie Wobble,15,20,"Helped with smaller implementation tasks.","Contributed consistently to writing and edits."
Nora Noodle,Group A,Cleo Cobble,20,20,"Picked up debugging and integration tasks late in the sprint.",
